Url,Headline,ProxyIP,Publication Date,Content,Image URL
https://apnews.com/article/lionel-messi-inter-miami-asia-hong-kong-7eb6f85e01e9f4c5ac338f2994b8bd89,Lionel Messi’s global tour with Inter Miami has been very messy and a PR nightmare,188.74.210.21,"February 05, 2024",It’s all been very messy. We’re talking about Lionel Messi and Inter Miami’s global tour of exhibition games where the main show has been Argentina’s 2022 World Cup-winning captain.,https://dims.apnews.com/dims4/default/ad35b82/2147483647/strip/true/crop/4000x2664+0+1/resize/599x399!/quality/90/?url=https%3A%2F%2Fassets.apnews.com%2Fbc%2F33%2Fb6c4492819fd0bb379d457ead91d%2F168bcd3be9c549069360948e8a14969a
https://apnews.com/article/messi-napkin-auction-45cd785ab747901b976a8b6a9cbae424,Lionel Messi’s first contract with Barcelona was signed on a napkin. Now it’s up for auction,188.74.210.21,"February 03, 2024","Lionel Messi’s record-breaking career with Barcelona started with a contract written on a napkin. It’s up for auction with a starting price of 300,000 pounds.",https://dims.apnews.com/dims4/default/c2b18e1/2147483647/strip/true/crop/3906x2602+37+0/resize/599x399!/quality/90/?url=https%3A%2F%2Fassets.apnews.com%2F0a%2F8a%2F997290080cfcd539d942d5aaf77c%2F5de9541f44274627aedb194f7f818fe3
https://apnews.com/article/lionel-messi-inter-miami-cruise-ship-1ccfb147210d422173b6bb86fc9ea0f4,"Lionel Messi and Inter Miami show off new jersey, help christen a new ship",188.74.210.21,"January 24, 2024","Lionel Messi showed off a new jersey, then helped christen a new ship. Inter Miami celebrated its partnership with cruise line Royal Caribbean International on Tuesday by sending Messi and his teammates to the Port of Miami, where they took part in the traditional naming of a new ship — the Icon of",https://dims.apnews.com/dims4/default/39c8234/2147483647/strip/true/crop/4119x2744+0+2/resize/599x399!/quality/90/?url=https%3A%2F%2Fassets.apnews.com%2F35%2F9f%2Fc262739a9006c465c1dd4a5d710a%2Fb713869623c44848a07ff59c0a27d400
https://apnews.com/article/lionel-messi-inter-miami-saudi-arabia-soccer-5f92f290013560f0b5baab8a648fa29a,Lionel Messi and Inter Miami are in Saudi Arabia to continue their around-the-world preseason tour,188.74.210.21,"January 28, 2024","Inter Miami played six preseason matches last season. Most were behind closed doors with few people watching, all took place in Florida and the biggest news probably came when some fans prematurely set off fireworks and got ejected from the exhibition-season opener.",https://dims.apnews.com/dims4/default/39c8234/2147483647/strip/true/crop/4119x2744+0+2/resize/599x399!/quality/90/?url=https%3A%2F%2Fassets.apnews.com%2F35%2F9f%2Fc262739a9006c465c1dd4a5d710a%2Fb713869623c44848a07ff59c0a27d400
https://apnews.com/article/lionel-messi-inter-miami-el-salvador-ee2f61bd198357345201a4bc6844990f,Lionel Messi and Inter Miami begin their preseason with a 0-0 draw against El Salvador,188.74.210.21,"January 20, 2024","Four days after being named FIFA’s best men’s player, Lionel Messi began the preseason with Inter Miami of Major League Soccer, which played to a scoreless draw with the El Salvador national team in an exhibition.",https://dims.apnews.com/dims4/default/61e0eb6/2147483647/strip/true/crop/8123x5411+0+2/resize/599x399!/quality/90/?url=https%3A%2F%2Fassets.apnews.com%2Fbc%2Fbd%2F629028f6d6491094404bc8ea9d56%2F654c6e3591c2409899e366b5ec43aa1f
https://apnews.com/article/qatar-world-cup-asian-cup-6f8a2b03958c9d478b47407daac5324d,Lionel Messi and the World Cup have left Qatar with a richer sports legacy,188.74.210.21,"January 27, 2024",Reminders of Lionel Messi and the 2022 World Cup are not hard to find in Qatar. “Last chance” tournament souvenirs greet visitors on arrival at Doha’s Hamad International Airport.,https://dims.apnews.com/dims4/default/88f318c/2147483647/strip/true/crop/7474x4979+0+2/resize/599x399!/quality/90/?url=https%3A%2F%2Fassets.apnews.com%2F94%2F17%2F24e29e668035f849fa759e67ca44%2F75f7d3aefe584cf2b8acbca0afbdee49
https://apnews.com/article/asian-cup-akram-afif-star-player-2968c9723e80993caacebb1fa4d07989,Lionel Messi lit up the 2022 World Cup in Qatar. Now it is Akram Afif’s turn to shine at Asian Cup,188.74.210.21,"January 18, 2024",Lionel Messi lit up the 2022 World Cup in Qatar. Now it is Akram Afif’s turn to shine. It is just over a year on from Messi’s triumph and Qatar is hosting another major tournament.,https://dims.apnews.com/dims4/default/60ba498/2147483647/strip/true/crop/2939x1958+0+1/resize/599x399!/quality/90/?url=https%3A%2F%2Fassets.apnews.com%2F54%2Fd5%2F82ea055df74f99b57416f4999d39%2F7d13d4acb1c544c0a5040123593467e5
https://apnews.com/article/messi-inter-miami-newells-0e8e0b17c0990d5cdc198d04c23e28b5,Messi and Inter Miami close messy preseason with 1-1 draw against Newell’s Old Boys,188.74.210.21,"February 16, 2024","Lionel Messi and Inter Miami brought their tumultuous Major League Soccer preseason to a close with a 1-1 draw against Messi’s boyhood club, Newell’s Old Boys.",https://dims.apnews.com/dims4/default/9fd9ed9/2147483647/strip/true/crop/4544x3027+0+1/resize/599x399!/quality/90/?url=https%3A%2F%2Fassets.apnews.com%2Fba%2Faa%2Fa7f7c4b01ef0ff1c71de70aeaf73%2F29946b6008ae44f5b2a6cc32cb1703a8
https://apnews.com/article/lionel-messi-mls-daaefe11b754f32a24ff01ef7eeab8bd,"Lionel Messi wasn’t seen at MLS media day. Doesn’t matter, since everyone talked about him",188.74.210.21,"January 11, 2024","Lionel Messi was not visible at Major League Soccer’s annual media day on Thursday. His shadow was. Messi is entering his first full season with Inter Miami, which creates an obvious storyline that seems to be on everyone’s mind as MLS teams enter their preseason training camps.",https://dims.apnews.com/dims4/default/0eeb694/2147483647/strip/true/crop/5133x3419+0+1/resize/599x399!/quality/90/?url=https%3A%2F%2Fassets.apnews.com%2F59%2F89%2Fa92ed7d4818fb9c5dc70b7e6ddae%2Fceb5694631734a69b05fc50b369553f9
https://apnews.com/article/luis-suarez-inter-miami-lionel-messi-1a8519bd76ab6324ce4b3eb93ab054fa,"Luis Suárez signs with Inter Miami, reunites with former Barcelona teammate Lionel Messi",188.74.210.21,"December 23, 2023","The long-awaited reunion of Luis Suárez and Lionel Messi is now a reality, after the Uruguayan striker signed with Inter Miami on Friday for the 2024 season.",https://dims.apnews.com/dims4/default/857a7ac/2147483647/strip/true/crop/4862x3239+0+1/resize/599x399!/quality/90/?url=https%3A%2F%2Fassets.apnews.com%2F91%2Fbc%2F8d1a74588cd490f4229fddc6ba30%2Fcbf9c6e592354cd88c8b3806e61b75e3
https://apnews.com/article/lionel-messi-japan-inter-miami-7ff3f3544d087d3077906d01e00a2508,Lionel Messi and Inter Miami add Japan stop to preseason tour,188.74.210.21,"December 15, 2023","The preseason tour for Lionel Messi and Inter Miami keeps growing, with the team revealing that a stop in Japan has now been added to the schedule.",https://dims.apnews.com/dims4/default/a5df6f2/2147483647/strip/true/crop/8640x5755+0+2/resize/599x399!/quality/90/?url=https%3A%2F%2Fassets.apnews.com%2F88%2F34%2F69402d6554b767b681eac18a123d%2F385fbd0903fa48c6b01092e942c748ea
https://apnews.com/article/messi-china-argentina-hong-kong-981eecd5c816c352b60a297fdd08c9e8,Furor over Messi no-show in Hong Kong game deepens with Argentina’s tour of China canceled,188.74.210.21,"February 11, 2024",The fallout from Lionel Messi’s failure to play in a club exhibition match in Hong Kong has spread with both of Argentina’s friendly matches as part of a tour of mainland China next month canceled by local football authorities.,https://dims.apnews.com/dims4/default/fa53ba3/2147483647/strip/true/crop/2514x1675+0+1/resize/599x399!/quality/90/?url=https%3A%2F%2Fassets.apnews.com%2Fb1%2F8f%2Fcd813e368c949c6060d65cf2815b%2F48f357af4444414381d2c9804c4f50b9
https://apnews.com/article/hong-kong-messi-inter-miami-4edbd6938d9c48f572d9ee54fe836168,"After public anger over Messi’s absence in Hong Kong game, organizer withdraws application for funds",188.74.210.21,"February 05, 2024",The organizer of a soccer match featuring Inter Miami in Hong Kong was dealing with backlash from both angry fans and the government after widespread disappointment that Lionel Messi didn’t play in the game.,https://dims.apnews.com/dims4/default/38e1127/2147483647/strip/true/crop/4000x2664+0+1/resize/599x399!/quality/90/?url=https%3A%2F%2Fassets.apnews.com%2F9e%2Fda%2F41faac5861769a5564a6bcb41886%2Fd14d6af53d35411b9688f17ac78d6b4b
https://apnews.com/article/inter-miami-messi-al-hilal-b8f1d4210c9a8f8e7a3c82e66d04af22,Messi and Inter Miami lose to Saudi Arabian team Al-Hilal,188.74.210.21,"January 30, 2024",Lionel Messi and Inter Miami have kicked off their tour of Saudi Arabia by losing to Al-Hilal 4-3. The Major League Soccer team is playing two games in the oil-rich kingdom as part of its offseason preparations but even Messi could not inspire it to victory in Riyadh.,https://dims.apnews.com/dims4/default/c797a1a/2147483647/strip/true/crop/4724x3147+0+2/resize/599x399!/quality/90/?url=https%3A%2F%2Fassets.apnews.com%2F4d%2F17%2Fe9a8e40d67f4b91cd00db550d909%2Fea80e2faf0ba4150b6e87fef125a9ddc
https://apnews.com/article/lionel-messi-super-bowl-b49a957e01b668f83725e6ede10eb56f,"Messi to make his Super Bowl debut, set to appear in Michelob Ultra ad",188.74.210.21,"January 26, 2024","Lionel Messi has won futbol’s biggest prize. He’ll now be part of American football’s biggest day. The Inter Miami star, World Cup champion and global soccer icon will headline a Super Bowl ad for Michelob Ultra, the brand has announced.",https://dims.apnews.com/dims4/default/40981a2/2147483647/strip/true/crop/4588x3056+0+1/resize/599x399!/quality/90/?url=https%3A%2F%2Fassets.apnews.com%2Fd9%2F26%2F8f4e82cbc1e8cc511dd474e7c012%2F22786ee403174eadb61a560ae8915fe3
https://apnews.com/sports/golden-state-warriors-soccer-boston-celtics-texas-tech-red-raiders-fc-barcelona-ca936d4cdfa7d897fa42a6cc89b829ce,Today in Sports - 16-year old Lionel Messi makes his official debut for FC Barcelona,188.74.210.21,"November 15, 2023","Today in Sports, November 16 - 16-year old Lionel Messi makes his official debut for FC Barcelona",No Image Found
https://apnews.com/article/olympics-mbappe-messi-soccer-france-argentina-f2c5afbd5939f1ba7de23fbdb3569b14,Messi vs. Mbappé on the global stage again? Argentina has qualified for the Paris Olympics,188.74.210.21,"February 12, 2024",The stars are starting to align for another Lionel Messi vs. Kylian Mbappé showdown on a global soccer stage to follow their epic World Cup final in 2022.,https://dims.apnews.com/dims4/default/afe5455/2147483647/strip/true/crop/4044x2694+0+1/resize/599x399!/quality/90/?url=https%3A%2F%2Fassets.apnews.com%2F4a%2Fc9%2Fe7cb375548a39c9d0a7d94f6e2da%2Fe72e7a92369a4ece82b40bb41d33fd2f
https://apnews.com/article/messi-inter-miami-japan-tokyo-e799b96f389e78213617562849ba4ec7,Messi plays and has chances but Vissel Kobe beats Inter Miami 4-3 on penalties in a friendly,188.74.210.21,"February 08, 2024","After leaving fans disappointed in Hong Kong, Lionel Messi put in a 30-minute appearance in Tokyo in Inter Miami’s latest exhibition match in Asia.",https://dims.apnews.com/dims4/default/5875e63/2147483647/strip/true/crop/2514x1675+0+1/resize/599x399!/quality/90/?url=https%3A%2F%2Fassets.apnews.com%2F3e%2F01%2F2839190c447885fd8500919e6b1c%2Fee61afb79d8e4282973bb2aee101271c
https://apnews.com/article/messi-ronaldo-miami-saudi-f4c501dd8634c6fb584691b0ae71a5f6,Messi’s Inter Miami routed 6-0 by Al-Nassr in a friendly as Ronaldo watches from stands,188.74.210.21,"February 02, 2024","What was billed as a potential final meeting between longtime rivals Lionel Messi and Cristiano Ronaldo didn’t materialize, but there was no doubt which of the superstars enjoyed Al-Nassr’s 6-0 rout of Inter Miami more.",https://dims.apnews.com/dims4/default/f5d8afe/2147483647/strip/true/crop/4724x3147+0+2/resize/599x399!/quality/90/?url=https%3A%2F%2Fassets.apnews.com%2F21%2F8f%2Fc6da11b459b3e5a5c93dbb7d5244%2Fb59b72f2ea92491ca2998bb1df68b944
https://apnews.com/article/messi-mls-newcomer-soccer-miami-a9e1ec6e69c1c98446daba971ab946c2,Lionel Messi is a finalist for the MLS Newcomer of the Year award,188.74.210.21,"October 27, 2023",Lionel Messi is a finalist for the MLS Newcomer of the Year award. The league announced the finalists for its season awards on Thursday.,https://dims.apnews.com/dims4/default/392325e/2147483647/strip/true/crop/5163x3439+0+1/resize/599x399!/quality/90/?url=https%3A%2F%2Fassets.apnews.com%2F41%2F9f%2F0c767590a0131b58aa9cb287de97%2F1d6c879417a94213abb8bf517d9546a8
https://apnews.com/article/messi-brazilian-fans-maracana-08abe53538d52140874cd2c284903f73,Lionel Messi draws Brazilian fans to what could be the Argentine great’s last match in Rio,188.74.210.21,"November 21, 2023",Many Brazilians have become fans of Lionel Messi in recent years. And many of them will be going to the Maracana Stadium to watch the World Cup champions take on their own national team in a qualifying match.,https://dims.apnews.com/dims4/default/59a98d2/2147483647/strip/true/crop/2518x1677+0+1/resize/599x399!/quality/90/?url=https%3A%2F%2Fassets.apnews.com%2F03%2F7f%2F5ac582bd690d39ba84cebc78e1d5%2Fd5aaf6011db44bd29f727c889a527098
https://apnews.com/article/lionel-messi-inter-miami-2f37964090a7f1481941acb598bba6e3,"Busy 2024 looms for Lionel Messi and Inter Miami, and club is figuring out how to make it work",188.74.210.21,"November 21, 2023","Inter Miami is putting together its preseason schedule, one that will likely have somewhere between four and six games early next year.",https://dims.apnews.com/dims4/default/05e0519/2147483647/strip/true/crop/3016x2009+1+0/resize/599x399!/quality/90/?url=https%3A%2F%2Fassets.apnews.com%2Fbe%2F1b%2Fdf2d7bcb643f390220c3130b1459%2F4842a9b6f96d4c88944dcb3de1a32273
https://apnews.com/article/argentina-exhibitions-china-tour-messi-ec2a4f7e88f07f93da3ec1913f8e8d9a,Lionel Messi’s Argentina to play Nigeria and Ivory Coast in March exhibitions during China tour,188.74.210.21,"January 31, 2024","Argentina will play exhibition games against Nigeria and Ivory Coast in China next month, making it likely Lionel Messi will miss Inter Miami’s Major League Soccer game at the New York Red Bulls on March 23.",https://dims.apnews.com/dims4/default/09aa674/2147483647/strip/true/crop/4724x3147+0+2/resize/599x399!/quality/90/?url=https%3A%2F%2Fassets.apnews.com%2Fce%2F68%2Fe6ee7a1558718fc0dca7938107e4%2Fc383d4acf63340edab3321c502570eec
https://apnews.com/article/hong-kong-messi-refund-angry-fans-184a2aa2a138ab2896230041aa862dd6,Anger over Messi’s absence in Hong Kong game spreads: Argentina friendly in mainland China canceled,188.74.210.21,"February 10, 2024",An Argentina soccer friendly in China next month has been canceled in more fallout from Lionel Messi failing to play in a club exhibition match in Hong Kong.,https://dims.apnews.com/dims4/default/5875e63/2147483647/strip/true/crop/2514x1675+0+1/resize/599x399!/quality/90/?url=https%3A%2F%2Fassets.apnews.com%2F3e%2F01%2F2839190c447885fd8500919e6b1c%2Fee61afb79d8e4282973bb2aee101271c
https://apnews.com/article/messi-japan-tokyo-vissel-kobe-inter-miami-1930d0d59b0eea2ca1858ff8c44aff33,Messi says he feels much better and hopes to play in Tokyo after a PR disaster in Hong Kong,188.74.210.21,"February 06, 2024",Look for Lionel Messi to play in Tokyo on Wednesday when Inter Miami faces Japanese club Vissel Kobe in a friendly.,https://dims.apnews.com/dims4/default/ad26d29/2147483647/strip/true/crop/4866x3241+0+1/resize/599x399!/quality/90/?url=https%3A%2F%2Fassets.apnews.com%2Fa1%2F57%2F30789294550f2d98c52875a8e125%2F478edbda080248abae0fada3525584af
https://apnews.com/article/lionel-messi-inter-miami-mls-soccer-ballon-dor-a535ef1626d9f5ff556ce0421ecd9821,Lionel Messi’s 8th Ballon D’Or trophy celebrated by Inter Miami in exhibition match,188.74.210.21,"November 11, 2023",Lionel Messi held the Ballon D’Or over his head as fireworks lit up the sky to bring a pregame ceremony to a close.,https://dims.apnews.com/dims4/default/82fd4c7/2147483647/strip/true/crop/6475x4313+0+2/resize/599x399!/quality/90/?url=https%3A%2F%2Fassets.apnews.com%2Fdc%2Fa0%2F073609adbf23e3684f663a815ce6%2F14e0df23383d4a3db387e784a6805613
https://apnews.com/article/messi-inter-miami-charlotte-cc1737910d49a5fa64929d3d4883b65f,Lionel Messi in starting lineup for Inter Miami in MLS season finale at Charlotte,188.74.210.21,"October 22, 2023",Lionel Messi is in the starting lineup for Inter Miami in its MLS season finale against FC Charlotte.,https://dims.apnews.com/dims4/default/8336993/2147483647/strip/true/crop/3580x2385+0+1/resize/599x399!/quality/90/?url=https%3A%2F%2Fassets.apnews.com%2F26%2F8a%2F63bab1759e61d96a024802954eb2%2F6cb2b8ef19e74c6ca10482330b0bd10c
https://apnews.com/article/luis-suarez-lionel-messi-inter-miami-b7963e8c369ec31dbe7c9293a979d40e,"Suárez’s training alongside Messi, Busquets and Alba with Inter Miami officially underway",188.74.210.21,"January 14, 2024","Lionel Messi, Luis Suárez, Sergio Busquets and Jordi Alba were all sitting together and smiling after a training session. This wasn’t Barcelona in 2014.",https://dims.apnews.com/dims4/default/05defce/2147483647/strip/true/crop/2597x1730+0+1/resize/599x399!/quality/90/?url=https%3A%2F%2Fassets.apnews.com%2Fe7%2Ffd%2F98d492e13cb59edbbf121a70b411%2F8a376c19605b48cdb9bfd02097ace811
https://apnews.com/sports/mens-college-basketball-chicago-bears-minnesota-vikings-lionel-messi-dc6a9aa715df247031b13744e382a39b,Today in Sports - 17-year old Lionel Messi makes his league debut for FC Barcelona,188.74.210.21,"October 15, 2023","Today in Sports, October 16 - 17-year old Lionel Messi makes his league debut for FC Barcelona",No Image Found
https://apnews.com/article/lionel-messi-inter-miami-ffcdc50b18a4636480c485352c9a5b43,"Lionel Messi may play Saturday, Inter Miami hints in social media post",188.74.210.21,"October 07, 2023",Lionel Messi’s absence from Inter Miami’s lineup may be over. The team used social media on Friday to post “Nos vemos mañana” with a photo of the seven-time Ballon d’Or winner.,https://dims.apnews.com/dims4/default/1270f02/2147483647/strip/true/crop/7663x5104+0+2/resize/599x399!/quality/90/?url=https%3A%2F%2Fassets.apnews.com%2F58%2Fde%2Ff55a076d59ce70e19a92237a5707%2Fe8cafb677237465588013c52f41ff405
https://apnews.com/article/sporting-kansas-city-messi-arrowhead-stadium-76a2c5ab55b4b8c7d550549f9d83ff1f,Sporting KC moves match against Lionel Messi’s Inter Miami to Chiefs’ Arrowhead Stadium,185.199.229.156,"January 09, 2024",Sporting Kansas City moved its April 13 Major League Soccer home game against Lionel Messi’s Inter Miami to Arrowhead Stadium from the team’s Children’s Mercy Park.,https://dims.apnews.com/dims4/default/0eeb694/2147483647/strip/true/crop/5133x3419+0+1/resize/599x399!/quality/90/?url=https%3A%2F%2Fassets.apnews.com%2F59%2F89%2Fa92ed7d4818fb9c5dc70b7e6ddae%2Fceb5694631734a69b05fc50b369553f9
https://apnews.com/article/messi-suarez-world-cup-qualifying-ea17ed41e5649ff0a315fe592829844e,Lionel Messi and Luis Suárez face off in World Cup qualifying. Brazil could field teenager Endrick,185.199.229.156,"November 15, 2023",Lionel Messi and Luiz Suárez will renew their on-the-field rivalry on Thursday in World Cup qualifying. Messi appears to have recovered from a muscle injury in his leg.,https://dims.apnews.com/dims4/default/aeb1a13/2147483647/strip/true/crop/8496x5659+72+0/resize/599x399!/quality/90/?url=https%3A%2F%2Fassets.apnews.com%2F61%2Fca%2F7d3d2eacae6ba8dd432cc22122c9%2F5ab46fbf3c034cca8f282191a651ffb7
https://apnews.com/article/world-cup-messi-argentina-brazil-neymar-67d55601487281f2d526a524a1376768,Lionel Messi remains a doubtful starter for Argentina. Neymar under fire in Brazil,185.199.229.156,"October 16, 2023",Lionel Messi’s involvement in a 1-0 win over Paraguay last week doesn’t necessarily mean he’ll be fit for Argentina’s next game in World Cup qualifying against Peru.,https://dims.apnews.com/dims4/default/032163b/2147483647/strip/true/crop/5080x3384+0+2/resize/599x399!/quality/90/?url=https%3A%2F%2Fassets.apnews.com%2Fb9%2F7f%2F8b279615e762beb59d640b4a07ec%2F39e8ce42e6284dc792a84d43327d1ce4
https://apnews.com/article/messi-inter-miami-fc-dallas-score-6cd4e21d94473f2e47bcd30df99804d1,"Messi has 3 shots on goal, exits in 2nd half in Inter Miami’s 1-0 loss to FC Dallas in MLS friendly",185.199.229.156,"January 23, 2024",Lionel Messi had three shots on goal before exiting early in the second half in Inter Miami’s 1-0 loss to FC Dallas in an MLS preseason game at the Cotton Bowl.,https://dims.apnews.com/dims4/default/ee2577c/2147483647/strip/true/crop/4742x3159+0+2/resize/599x399!/quality/90/?url=https%3A%2F%2Fassets.apnews.com%2Ffd%2F94%2F97f9251b0dd1d861364d117f8493%2Fa7f4e74170bd44de8ba3cd44ed3d7673
https://apnews.com/article/messi-inter-miami-absent-hong-kong-9d8d2e99d46069e1d469dd7338b240d6,Fans unhappy at not seeing injured Messi play as Inter Miami cruises past Hong Kong XI 4-1,185.199.229.156,"February 04, 2024",Hong Kong soccer fans and government have expressed their disappointment as Lionel Messi stayed on the bench for the full 90 minutes while Inter Miami defeated a Hong Kong XI 4-1 in the latest stop on the MLS team’s preseason Asian tour.,https://dims.apnews.com/dims4/default/38e1127/2147483647/strip/true/crop/4000x2664+0+1/resize/599x399!/quality/90/?url=https%3A%2F%2Fassets.apnews.com%2F9e%2Fda%2F41faac5861769a5564a6bcb41886%2Fd14d6af53d35411b9688f17ac78d6b4b
https://apnews.com/article/messi-haaland-guardiola-ballon-dor-410927dbd55607f5e5ef95d0806f0417,Pep Guardiola says Lionel Messi and Erling Haaland both deserve to win Ballon d’Or,185.199.229.156,"October 20, 2023",Pep Guardiola says Lionel Messi and Erling Haaland both deserve to win this year’s Ballon d’Or award for the world’s best soccer player.,https://dims.apnews.com/dims4/default/2f64ee3/2147483647/strip/true/crop/5276x3514+0+1/resize/599x399!/quality/90/?url=https%3A%2F%2Fassets.apnews.com%2F56%2F30%2F704cab2b8568fc7ee7c31d18724b%2Fc0d7f3b3735f45b09073c9bc8675afbc
https://apnews.com/sports/detroit-lions-arizona-cardinals-7f285399526d421c40eabf80ebe97011,Today in Sports - Lionel Messi becomes the UEFA Champions League all-time scorer,185.199.229.156,"November 24, 2023","Today in Sports, November 25 - Lionel Messi becomes the UEFA Champions League all-time scorer",No Image Found
https://apnews.com/article/fifa-awards-messi-haaland-mbappe-bonmati-hermoso-caicedo-f06f6d4df100b48af5f3c25c78f801f7,Messi edges Haaland in tiebreaker for FIFA’s best men’s player award. Bonmatí takes women’s prize,185.199.229.156,"January 16, 2024",Lionel Messi has landed another prestigious award in soccer but the Argentina star needed a tiebreaker with Erling Haaland to win FIFA’s best men’s player prize on Monday.,https://dims.apnews.com/dims4/default/223b9ea/2147483647/strip/true/crop/7893x5258+0+2/resize/599x399!/quality/90/?url=https%3A%2F%2Fassets.apnews.com%2F27%2F48%2F0a70f003f2369218bc4c12b4e809%2Fccbec38b10824f089db3a4cd665bb470
https://apnews.com/article/messi-inter-miami-atlanta-united-c20eb0e096509acfa29ee9d59c4c2c7e,"Lionel Messi misses 2nd match this week, doesn’t dress for Miami at Atlanta",185.199.229.156,"September 17, 2023","Inter Miami star Lionel Messi did not dress for a match at Atlanta United, the second match he missed this week.",https://dims.apnews.com/dims4/default/56ae063/2147483647/strip/true/crop/4202x2799+0+1/resize/599x399!/quality/90/?url=https%3A%2F%2Fassets.apnews.com%2F3e%2F0a%2F2e3c524ab91547eded82c0169528%2F77334659c02e452186248bff21280805
https://apnews.com/article/lionel-messi-inter-miami-chicago-fire-9ff345b85433e92796e32d3fcf5b170e,Lionel Messi misses Inter Miami’s game at Chicago because of scar tissue ailment,185.199.229.156,"October 05, 2023","Lionel Messi wasn’t in Chicago with Inter Miami on Wednesday night for a game against the Fire, missing his fifth match in the last six with the MLS club.",https://dims.apnews.com/dims4/default/1270f02/2147483647/strip/true/crop/7663x5104+0+2/resize/599x399!/quality/90/?url=https%3A%2F%2Fassets.apnews.com%2F58%2Fde%2Ff55a076d59ce70e19a92237a5707%2Fe8cafb677237465588013c52f41ff405
https://apnews.com/article/lionel-messi-inter-miami-6c5329da2f205f9113af11dbf015172d,"Lionel Messi’s status is unclear, and the Chicago Fire want to lure fans to Soldier Field anyway",185.199.229.156,"October 04, 2023","Lionel Messi was on the practice field with Inter Miami on Tuesday, though it remains unclear when or if the seven-time Ballon d’Or winner will play with the Major League Soccer team again this season.",https://dims.apnews.com/dims4/default/9116b25/2147483647/strip/true/crop/4403x2933+0+1/resize/599x399!/quality/90/?url=https%3A%2F%2Fassets.apnews.com%2F27%2Fb4%2F2ef758d33494833371a77c2ab5e5%2F33d0854825e14c9d927583e20c61d65b
https://apnews.com/article/lionel-messi-mls-schedule-657a4cb7fc029ecf41216c7b6b0da304,Messi’s Miami opens MLS on Feb. 21. Star could miss at least 6 matches while with Argentina,185.199.229.156,"December 21, 2023","Lionel Messi’s first full season with Major League Soccer’s Inter Miami starts Feb. 21 at home against Real Salt Lake in a matchup three days ahead of other openers, and Messi could miss at least six games while with Argentina’s national team.",https://dims.apnews.com/dims4/default/0eeb694/2147483647/strip/true/crop/5133x3419+0+1/resize/599x399!/quality/90/?url=https%3A%2F%2Fassets.apnews.com%2F59%2F89%2Fa92ed7d4818fb9c5dc70b7e6ddae%2Fceb5694631734a69b05fc50b369553f9
