Url,Headline,ProxyIP,Publication Date,Content,Image URL
https://apnews.com/article/world-cup-sports-france-lionel-messi-antoine-griezmann-17a6e57e926af065240fb68efe741d3a,"Griezmann gives his all, France advances to World Cup final",45.155.68.129,"December 15, 2022",Darting runs. Key tackles. Timely interceptions. Calming passes. Antoine Griezmann did it all for France and now he’s going to his second World Cup final.,https://dims.apnews.com/dims4/default/c2a61a8/2147483647/strip/true/crop/2000x1332+0+1/resize/599x399!/quality/90/?url=https%3A%2F%2Fstorage.googleapis.com%2Fafs-prod%2Fmedia%2F71261449e9814b85a60d77fa7ab50409%2F2000.jpeg
https://apnews.com/article/sports-soccer-paris-saint-germain-fc-bayern-munich-christophe-galtier-b40b7773de70ffb56250cd373f4f9da3,Messi to be available for Champions League game with Bayern,45.155.68.129,"February 10, 2023","PARIS (AP) — Lionel Messi will be available for the Champions League game against Bayern Munich on Tuesday despite being left out of the squad for this weekend’s French league match at Monaco, Paris Saint-Germain coach Christophe Galtier said Friday.",https://dims.apnews.com/dims4/default/b96bfb4/2147483647/strip/true/crop/2403x1601+0+1/resize/599x399!/quality/90/?url=https%3A%2F%2Fstorage.googleapis.com%2Fafs-prod%2Fmedia%2Ff7869d1bf8f84985b8fca2312f96d7ee%2F2403.jpeg
https://apnews.com/article/sports-fifa-world-cup-cristiano-ronaldo-argentina-national-soccer-team-dc-united-b3cb626c561e1eee336af17829c0f66a,Ronaldo Saudi move to signal likely end of elite club career,45.155.68.129,"January 01, 2023","Less than two weeks after his great rival Lionel Messi lifted the World Cup, Cristiano Ronaldo has completed a move to Saudi Arabian club Al Nassr and likely signalled the end of his career in elite club soccer.",https://dims.apnews.com/dims4/default/e335e30/2147483647/strip/true/crop/2998x1997+1+0/resize/599x399!/quality/90/?url=https%3A%2F%2Fstorage.googleapis.com%2Fafs-prod%2Fmedia%2F87d23d53cebc48b68b84e768fb8ccec1%2F3000.jpeg
https://apnews.com/article/world-cup-sports-buenos-aires-argentina-lionel-messi-706695926ca27dccafd39c915922a7c5,Argentina erupts in joy after team reaches World Cup final,45.155.68.129,"December 14, 2022",The streets of Argentina have turned into a party as the national team beat Croatia by a comfortable 3-0 and earned this soccer-crazed South American country a spot in the World Cup final.,https://dims.apnews.com/dims4/default/6ab27a7/2147483647/strip/true/crop/2998x1997+1+0/resize/599x399!/quality/90/?url=https%3A%2F%2Fstorage.googleapis.com%2Fafs-prod%2Fmedia%2Fe6e76fc09db446cb80573a9e3a4430d3%2F3000.jpeg
https://apnews.com/article/world-cup-politics-sports-argentina-lionel-messi-19fe7457c422a13e045ee7007d815fca,EXPLAINER: Why are Argentines such ardent World Cup fans?,45.155.68.129,"December 17, 2022","Argentina arguably has the World Cup’s most fervent fans. They are known for their rhythmical singing, incessant drumming and trance-like ferocity.",https://dims.apnews.com/dims4/default/9d51db8/2147483647/strip/true/crop/3000x1998+0+1/resize/599x399!/quality/90/?url=https%3A%2F%2Fstorage.googleapis.com%2Fafs-prod%2Fmedia%2F1eb221205eb3443d9286887afe7a6041%2F3000.jpeg
https://apnews.com/article/world-cup-sports-england-lionel-messi-cristiano-ronaldo-9fb023ef2b33ddd955e665c1e5935a69,England defender Walker aims to contain Mbappe at World Cup,45.155.68.129,"December 07, 2022",Kylian Mbappe is living up to his reputation at the World Cup as the man best-placed to succeed Lionel Messi and Cristiano Ronaldo as soccer’s biggest star.,https://dims.apnews.com/dims4/default/baf128a/2147483647/strip/true/crop/2747x1830+0+1/resize/599x399!/quality/90/?url=https%3A%2F%2Fstorage.googleapis.com%2Fafs-prod%2Fmedia%2Ff9cf07d99f9543d497c2673508916f7d%2F2747.jpeg
https://apnews.com/article/transfer-window-mbappe-kane-mount-89027c06a5d1719dd2b922445dfb5d9b,Top players who could be on the move during soccer’s transfer window,45.155.68.129,"June 28, 2023",Lionel Messi and Karim Benzema kicked off the transfer window in spectacular fashion and more of soccer’s biggest stars could also be on the mover.,https://dims.apnews.com/dims4/default/da2d8d6/2147483647/strip/true/crop/2848x1897+0+1/resize/599x399!/quality/90/?url=https%3A%2F%2Fassets.apnews.com%2Fcc%2F73%2Febbb6df1818bb7a5cb61d2ab774a%2Fb704022c606741aeb4f991f6d93bb308
https://apnews.com/article/world-cup-sports-argentina-lionel-messi-qatar-f2a97be74da870cc0ba867cf949eb941,FIFA mostly wins big but loses some trust at Qatar World Cup,45.155.68.129,"December 20, 2022",FIFA president Gianni Infantino was calling it “the best World Cup ever” in Qatar even before an epic final won by Lionel Messi and Argentina against France.,https://dims.apnews.com/dims4/default/391eb4a/2147483647/strip/true/crop/3000x1998+0+1/resize/599x399!/quality/90/?url=https%3A%2F%2Fstorage.googleapis.com%2Fafs-prod%2Fmedia%2F6a2dfea3dbbd428195fd8836a2b0b516%2F3000.jpeg
https://apnews.com/article/soccer-sports-la-liga-ligue-1-world-cup-5cb0464cad58b5245d15a758a9bb299f,Lionel Messi eyes Champions League trophy with PSG,45.155.68.129,"August 11, 2021",Lionel Messi says he’s “in the right place” to win another Champions League trophy and cited a reunion with Neymar as a key factor in his decision to sign with Paris Saint-Germain.,https://dims.apnews.com/dims4/default/439e3f1/2147483647/strip/true/crop/3000x1998+0+1/resize/599x399!/quality/90/?url=https%3A%2F%2Fstorage.googleapis.com%2Fafs-prod%2Fmedia%2F19477e51da0749fb861ab0f1e99d5c8e%2F3000.jpeg
https://apnews.com/article/sports-soccer-paris-saint-germain-fc-olympique-de-marseille-lionel-messi-ecebd2af7fd65aca72ee84bfb9e611b2,Mbappé and Messi combine as leader PSG wins 3-0 at Marseille,45.155.68.129,"February 27, 2023",PARIS (AP) — Kylian Mbappé scored twice and Lionel Messi got the other goal as the World Cup final stars combined to give French league leader Paris Saint-Germain a 3-0 win at title challenger Marseille.,https://dims.apnews.com/dims4/default/25a8afb/2147483647/strip/true/crop/3000x1998+0+1/resize/599x399!/quality/90/?url=https%3A%2F%2Fstorage.googleapis.com%2Fafs-prod%2Fmedia%2F562850c9534e426b9fc30584516938bc%2F3000.jpeg
https://apnews.com/article/world-cup-france-preview-mbappe-desc-c35fd4c43cd22f07a242e1c1fe491ddf,"World Cup history beckons for France, Mbappé, Deschamps",45.155.68.129,"December 15, 2022","World Cup history is beckoning for France, star player Kylian Mbappé and coach Didier Deschamps. Soccer lore is waiting to be written for the team when France walks on the field Sunday for the tournament final against Argentina and Lionel Messi.",https://dims.apnews.com/dims4/default/ae185f9/2147483647/strip/true/crop/3000x1998+0+1/resize/599x399!/quality/90/?url=https%3A%2F%2Fstorage.googleapis.com%2Fafs-prod%2Fmedia%2F1abbce8efdbe4a6598af82d0df51b212%2F3000.jpeg
https://apnews.com/article/sports-soccer-luxembourg-city-lionel-messi-a8b29589b9ae87e915acff920f7a56a5,European Court rules against Barcelona fans over Messi deal,45.155.68.129,"February 08, 2023",LUXEMBOURG (AP) — The European Court on Wednesday ruled against a Barcelona fan group in France that demanded that the European Commission should investigate whether Paris Saint-Germain unfairly signed Lionel Messi and jeopardized Barcelona’s finances.,https://dims.apnews.com/dims4/default/76cbea8/2147483647/strip/true/crop/3000x1998+0+1/resize/599x399!/quality/90/?url=https%3A%2F%2Fstorage.googleapis.com%2Fafs-prod%2Fmedia%2F94acd074cb8d4f21aab7ac7d6d8e0838%2F3000.jpeg
https://apnews.com/article/sports-soccer-paris-saint-germain-fc-lille-osc-olympique-de-marseille-7684d1c665ef0fe2e95e548d19e42809,"Mbappe, Messi inspire PSG to 4-3 win against Lille",154.95.36.199,"February 20, 2023",PARIS (AP) — Paris Saint-Germain was only minutes away from a fourth consecutive loss on Sunday when Kylian Mbappe and Lionel Messi came to the rescue to avert a major crisis at the Qatari-backed club.,https://dims.apnews.com/dims4/default/c4cd211/2147483647/strip/true/crop/3000x1998+0+1/resize/599x399!/quality/90/?url=https%3A%2F%2Fstorage.googleapis.com%2Fafs-prod%2Fmedia%2Ff15778f655b449d1a9aab1deb016996a%2F3000.jpeg
https://apnews.com/article/world-cup-sports-soccer-argentina-national-team-lionel-messi-c75375d654e57d022196afd2a63ce3dd,Messi has doubts about playing 2026 World Cup at age 39,154.95.36.199,"February 03, 2023","BUENOS AIRES (AP) — Lionel Messi may be in doubt as to whether he’ll be still playing for Argentina at the 2026 World Cup but he’s sure about one thing: he wants Lionel Scaloni to stay on as head coach until then, regardless.",https://dims.apnews.com/dims4/default/f8460db/2147483647/strip/true/crop/3000x1998+0+1/resize/599x399!/quality/90/?url=https%3A%2F%2Fstorage.googleapis.com%2Fafs-prod%2Fmedia%2F51c21ab48b5540ad96c58e2714a38df8%2F3000.jpeg
https://apnews.com/article/sports-crime-lionel-messi-dani-alves-barcelona-19cb09ba231c5da5d78f3f6994b47ad4,Lawyer who worked for Messi joins Alves’ defense team,154.95.36.199,"January 25, 2023","BARCELONA, Spain (AP) — The lawyer who worked for Lionel Messi in his tax fraud case has been added to the defense team of former Barcelona defender Dani Alves, who is facing sexual assault charges.",https://dims.apnews.com/dims4/default/da66a6f/2147483647/strip/true/crop/3000x1998+0+1/resize/599x399!/quality/90/?url=https%3A%2F%2Fstorage.googleapis.com%2Fafs-prod%2Fmedia%2Ff5c04eaa7a0042eeb5fc465368842790%2F3000.jpeg
https://apnews.com/article/world-cup-sports-soccer-international-middle-east-5963fa509a69a118dd7986fcc414eeaa,Viewer’s guide for the World Cup in Qatar,154.95.36.199,"November 14, 2022",The World Cup starts in Qatar on Sunday. It’s one of the most eagerly anticipated World Cups in memory as much for off-the-field reasons as those on it.,https://dims.apnews.com/dims4/default/23a743a/2147483647/strip/true/crop/2893x1927+54+0/resize/599x399!/quality/90/?url=https%3A%2F%2Fstorage.googleapis.com%2Fafs-prod%2Fmedia%2Fb71ed6ccabfa4a18b349c0bb093ef763%2F3000.jpeg
https://apnews.com/article/world-cup-sports-argentina-national-soccer-team-france-karim-benzema-17e27de4b53fbfb4f1ece6959680cbf3,"Messi, Mbappe and Benzema battle for FIFA Best Player award",154.95.36.199,"February 10, 2023","ZURICH (AP) — It’s Lionel Messi vs. Kylian Mbappé again, this time for the FIFA Best Men’s Player award for 2022.",https://dims.apnews.com/dims4/default/88cc748/2147483647/strip/true/crop/3000x1998+0+1/resize/599x399!/quality/90/?url=https%3A%2F%2Fstorage.googleapis.com%2Fafs-prod%2Fmedia%2F75ad0d856f3b47d58649e12999fb8fff%2F3000.jpeg
https://apnews.com/article/uefa-ceferin-saudi-arabia-ronaldo-benzema-0b601d2c8460dd48f13b904a5bbf75f9,UEFA president Čeferin dismisses idea of threat to European soccer from big-spending Saudis,154.95.36.199,"June 18, 2023",UEFA president Aleksander Čeferin says European soccer should not be afraid of a player exodus to Saudi Arabian clubs.,https://dims.apnews.com/dims4/default/d5434cc/2147483647/strip/true/crop/3000x1998+0+1/resize/599x399!/quality/90/?url=https%3A%2F%2Fstorage.googleapis.com%2Fafs-prod%2Fmedia%2F0011752dfb804e9f8697bdd8f30a8d2b%2F3000.jpeg
https://apnews.com/article/world-cup-soccer-sports-argentina-middle-east-f7520e9411055c15682da27ad615b340,"Argentines shocked, saddened by loss to Saudis at World Cup",154.95.36.199,"November 23, 2022",Shock and sadness engulfed the streets of Buenos Aires as Argentina’s national team lost 2-1 to Saudi Arabia in its opening match of the World Cup.,https://dims.apnews.com/dims4/default/f70cf20/2147483647/strip/true/crop/3000x1998+0+1/resize/599x399!/quality/90/?url=https%3A%2F%2Fstorage.googleapis.com%2Fafs-prod%2Fmedia%2Fef93209f3bc0484eb426e05070fabef8%2F3000.jpeg
https://apnews.com/article/world-cup-sports-europe-cristiano-ronaldo-lionel-messi-4f7dc3515cc4aabce4a421c57460a084,It’s Messi vs. Ronaldo again in unlikely Saudi reunion,154.95.36.199,"January 17, 2023",One of the greatest rivalries in soccer history is set to resume at the unlikely venue of Riyadh’s King Fahd International Stadium.,https://dims.apnews.com/dims4/default/c4b15f8/2147483647/strip/true/crop/1964x1308+18+0/resize/599x399!/quality/90/?url=https%3A%2F%2Fstorage.googleapis.com%2Fafs-prod%2Fmedia%2Fd6955ce40cae43beb19437f09156edeb%2F2000.jpeg
https://apnews.com/ap-verifica-00000189f5e6df66afcdf7efb53f0000,Messi no pidió votar por aspirante presidencial ultraderechista en Argentina,154.95.36.199,"August 15, 2023","LA AFIRMACIÓN: El futbolista argentino, Lionel Messi, llamó a votar en una entrevista por el precandidato ultraderechista a la presidencia de Argentina, Javier Milei.",https://dims.apnews.com/dims4/default/723774e/2147483647/strip/true/crop/2000x1332+0+0/resize/599x399!/quality/90/?url=https%3A%2F%2Fstorage.googleapis.com%2Fafs-prod%2Fmedia%2Fe81843cbaec345cab0009153b9795ce8%2F2000.jpeg
https://apnews.com/article/brooklyn-nets-sports-fifa-world-cup-paris-saint-germain-fc-lionel-messi-c23f3ecea55c81ee003e81850b15316b,PSG coach hopes Messi can play next Wednesday,154.95.36.199,"January 05, 2023",PARIS (AP) — Paris Saint-Germain coach Christophe Galtier hopes World Cup winner Lionel Messi is ready to play in a French league game at home to Angers next Wednesday.,https://dims.apnews.com/dims4/default/ab90d95/2147483647/strip/true/crop/3000x1998+0+1/resize/599x399!/quality/90/?url=https%3A%2F%2Fstorage.googleapis.com%2Fafs-prod%2Fmedia%2Fc189ac9cfa634e24b3a2d24bdb3db1d2%2F3000.jpeg
https://apnews.com/article/sports-soccer-paris-saint-germain-fc-toulouse-achraf-hakimi-95fccdef5f668dd9c34146aac0be7c19,Messi’s goal helps French leader PSG beat Toulouse 2-1,154.95.36.199,"February 05, 2023","PARIS (AP) — After Lionel Messi’s second-half goal helped a lackluster Paris Saint-Germain beat Toulouse 2-1 to move eight points clear at the top of the French league on Saturday, the team was urged to lighten their superstar’s load.",https://dims.apnews.com/dims4/default/5ceb639/2147483647/strip/true/crop/3000x1998+0+1/resize/599x399!/quality/90/?url=https%3A%2F%2Fstorage.googleapis.com%2Fafs-prod%2Fmedia%2Fc16a8b4cbc87402aab1d9bd7a6096675%2F3000.jpeg
https://apnews.com/article/world-cup-sports-germany-argentina-lionel-messi-d1b26cd4b22d80fd08c25184c9abb2f2,Messi ties World Cup appearance record with Matthaus,154.95.36.199,"December 14, 2022","LUSAIL, Qatar (AP) — Lionel Messi tied the record for most appearances at the World Cup on Tuesday when he played for the 25th time for Argentina at soccer’s biggest tournament.",https://dims.apnews.com/dims4/default/835f8c7/2147483647/strip/true/crop/3000x1998+0+1/resize/599x399!/quality/90/?url=https%3A%2F%2Fstorage.googleapis.com%2Fafs-prod%2Fmedia%2Fd2b0122dc1d04a21b4e26bc4b5ec1161%2F3000.jpeg
https://apnews.com/article/sports-soccer-fifa-world-cup-nottingham-valencia-cf-1690aa83b45dba9f3b5b68371855f5e2,MATCHDAY: Messi returns for PSG; City plays in League Cup,154.95.36.199,"January 11, 2023",A look at what’s happening in European soccer on Wednesday:FRANCELionel Messi is expected to play his first game for Paris Saint-Germain since his World Cup victory with Argentina.,https://dims.apnews.com/dims4/default/ab90d95/2147483647/strip/true/crop/3000x1998+0+1/resize/599x399!/quality/90/?url=https%3A%2F%2Fstorage.googleapis.com%2Fafs-prod%2Fmedia%2Fc189ac9cfa634e24b3a2d24bdb3db1d2%2F3000.jpeg
https://apnews.com/article/soccer-sports-france-venezuela-middle-east-3de18259d60fd4039149cc86c238c005,Lionel Messi ponders future after Argentina beats Venezuela,154.95.36.199,"March 26, 2022",BUENOS AIRES (AP) — Lionel Messi says he will reconsider his future in soccer later this year but said it’s likely “many things will change” after the World Cup in November and December in Qatar.,https://dims.apnews.com/dims4/default/0e02c8e/2147483647/strip/true/crop/3000x1998+0+27/resize/599x399!/quality/90/?url=https%3A%2F%2Fstorage.googleapis.com%2Fafs-prod%2Fmedia%2Ffd8fe1743df84e8e8d02d391fa82a2a8%2F3000.jpeg
https://apnews.com/article/world-cup-sports-portugal-national-soccer-team-france-robert-lewandowski-0c6062ca8afb5e04063aec8962208a7b,"Ronaldo left off FIFA award list headed by Messi, Mbappé",154.95.36.199,"January 12, 2023","ZURICH (AP) — Cristiano Ronaldo was left off the the 14-player shortlist for the annual Best FIFA Men’s Player award for the first time, with Lionel Messi and Kylian Mbappé among those selected.",https://dims.apnews.com/dims4/default/dd58494/2147483647/strip/true/crop/3000x1998+0+1/resize/599x399!/quality/90/?url=https%3A%2F%2Fstorage.googleapis.com%2Fafs-prod%2Fmedia%2F688e13b7000f4ac4bfc34aa28e4c9508%2F3000.jpeg
https://apnews.com/article/mbappe-psg-future-madrid-transfer-france-e38e56582915329382a69d12d7c33a46,"Mbappé insists he’ll start next season at PSG, plays down the fuss about his letter",154.95.36.199,"June 16, 2023","Kylian Mbappé insists he will start next season with French champion Paris Saint-Germain, and the superstar defended his decision to inform PSG by letter that he won’t trigger a 12-month extension on his contract.",https://dims.apnews.com/dims4/default/a81b84c/2147483647/strip/true/crop/5616x3741+0+2/resize/599x399!/quality/90/?url=https%3A%2F%2Fassets.apnews.com%2F43%2F12%2F5b8616184fd82e616df162042af7%2Fc1b81cacfec24dddbabcd38ad50414ed
https://apnews.com/article/sports-soccer-ligue-1-213f2f86bb27611fd77bfc0c60d86253,Lionel Messi ruled out of PSG match against Benfica,154.95.36.199,"October 10, 2022","PARIS (AP) — Lionel Messi will miss Paris Saint-Germain’s Champions League match against Benfica on Tuesday because of a minor leg injury, the French club said.",https://dims.apnews.com/dims4/default/7eb942f/2147483647/strip/true/crop/3000x1998+0+1/resize/599x399!/quality/90/?url=https%3A%2F%2Fstorage.googleapis.com%2Fafs-prod%2Fmedia%2F09fa26cc36a94438b75b6d2bd6788fef%2F3000.jpeg
https://apnews.com/article/sports-soccer-fifa-world-cup-paris-saint-germain-fc-cristiano-ronaldo-0b311d2a9eb82c5a9a7fdc149a23d381,"Ronaldo set to face PSG, Messi in first game in Saudi Arabia",154.95.36.199,"January 09, 2023",PARIS (AP) — Cristiano Ronaldo’s first game in Saudi Arabia is set to be against Paris Saint-Germain and a possible reunion with his career-long rival Lionel Messi.,https://dims.apnews.com/dims4/default/ef7d799/2147483647/strip/true/crop/3000x1998+0+71/resize/599x399!/quality/90/?url=https%3A%2F%2Fstorage.googleapis.com%2Fafs-prod%2Fmedia%2F1061d3e201c74196a9287d2ac8440676%2F3000.jpeg
https://apnews.com/article/world-cup-sports-argentina-lionel-messi-angel-di-maria-57faf829f6330e0dda823a1f9891cc3b,Messi’s hometown of Rosario celebrates after World Cup win,154.95.36.199,"December 19, 2022","ROSARIO, Argentina (AP) — The streets of Lionel Messi’s hometown of Rosario erupted in celebration on Sunday after Argentina beat France to win its third World Cup title.",https://dims.apnews.com/dims4/default/1ffae34/2147483647/strip/true/crop/3000x1998+0+1/resize/599x399!/quality/90/?url=https%3A%2F%2Fstorage.googleapis.com%2Fafs-prod%2Fmedia%2Feb56b3c50051416680e4e907da9d6c32%2F3000.jpeg
https://apnews.com/article/soccer-sports-argentina-lionel-messi-qatar-eea17311da3cda0f864c47ef78861f9c,Messi likened to skiing great Alberto Tomba by Poland coach,154.95.36.199,"November 29, 2022","DOHA, Qatar (AP) — Poland coach Czeslaw Michniewicz delved into the worlds of skiing and tennis when assessing the task facing his players in stopping Argentina great Lionel Messi at the World Cup.",https://dims.apnews.com/dims4/default/520dac2/2147483647/strip/true/crop/3000x1998+0+0/resize/599x399!/quality/90/?url=https%3A%2F%2Fstorage.googleapis.com%2Fafs-prod%2Fmedia%2F6fa48a15336d4f78bc5e10f2d8c73382%2F3000.jpeg
https://apnews.com/article/world-cup-sports-argentina-lionel-messi-neymar-1a0ed3c73d389bb1e7ffbf10dddbfb8c,"After Neymar, Croatia aims to end Messi’s World Cup dream",154.95.36.199,"December 12, 2022","AL KHOR, Qatar (AP) — Croatia has already ended Neymar’s World Cup dream. Now it hopes to do the same to Lionel Messi.",https://dims.apnews.com/dims4/default/642537e/2147483647/strip/true/crop/3000x1998+0+0/resize/599x399!/quality/90/?url=https%3A%2F%2Fstorage.googleapis.com%2Fafs-prod%2Fmedia%2Fb7de4736df0d4b97b88ff8a71d86327e%2F3000.jpeg
https://apnews.com/article/sports-soccer-atletico-madrid-getafe-cf-europe-e0eeac5d3b44f6ebdbb0097060a3bb41,"Barcelona wins Super Cup for 1st trophy with Xavi, no Messi",154.95.36.199,"January 16, 2023",MADRID (AP) — Barcelona’s title drought with coach Xavi — and without Lionel Messi — is finally over.,https://dims.apnews.com/dims4/default/cba027f/2147483647/strip/true/crop/3000x1998+0+1/resize/599x399!/quality/90/?url=https%3A%2F%2Fstorage.googleapis.com%2Fafs-prod%2Fmedia%2Fb6ee4773b1054f97943615725d1a102e%2F3000.jpeg
https://apnews.com/article/world-cup-sports-argentina-lionel-messi-liverpool-fc-492deed447baacf6d72187a9f8bddea7,Messi resumes World Cup quest as Argentina plays Netherlands,154.95.36.199,"December 09, 2022","DOHA, Qatar (AP) — Lionel Messi up against Virgil van Dijk. The youngest coach at the World Cup taking on the oldest. South America versus Europe.",https://dims.apnews.com/dims4/default/e092009/2147483647/strip/true/crop/3000x1998+0+1/resize/599x399!/quality/90/?url=https%3A%2F%2Fstorage.googleapis.com%2Fafs-prod%2Fmedia%2Fc7e036e6e6ab4602ab3db4524d5e1b45%2F3000.jpeg
https://apnews.com/article/world-cup-sports-france-argentina-lionel-messi-d06acc303d840f0a66ed2aa003855722,"Messi seeks glory, Argentina meets France in World Cup final",154.95.36.199,"December 18, 2022","DOHA, Qatar (AP) — It is now or never for Lionel Messi.The Argentina superstar’s once-in-a-generation career will be defined — for many — by whether he leads his country to the World Cup title on Sunday.",https://dims.apnews.com/dims4/default/6f06fb2/2147483647/strip/true/crop/3000x1998+0+1/resize/599x399!/quality/90/?url=https%3A%2F%2Fstorage.googleapis.com%2Fafs-prod%2Fmedia%2F55445c67339b4b448ba96451c52c147d%2F3000.jpeg
https://apnews.com/article/sports-fifa-world-cup-france-national-soccer-team-olympique-de-marseille-paris-saint-germain-fc-688acfb783ceb4ee032b0719fe57f31a,Messi scores in 1st game after World Cup as PSG wins,154.95.36.199,"January 12, 2023",PARIS (AP) — Lionel Messi scored in his first game since leading Argentina to the World Cup title as French league leader Paris Saint-Germain beat Angers 2-0 on Wednesday.,https://dims.apnews.com/dims4/default/3f23eb8/2147483647/strip/true/crop/1995x1329+0+1/resize/599x399!/quality/90/?url=https%3A%2F%2Fstorage.googleapis.com%2Fafs-prod%2Fmedia%2Fbaeb1b384b0e430e831c8dfbdd201ea2%2F1995.jpeg
https://apnews.com/article/sports-fifa-world-cup-lionel-messi-paris-saint-germain-fc-france-national-soccer-team-0c7857a71d99ee8d22e1d36cdc7c121d,Messi vs. Mbappé Part II: World Cup stars chase Ballon d’Or,154.95.36.199,"January 09, 2023",PARIS (AP) — Lionel Messi finally has something Kylian Mbappé already had with a World Cup winners’ medal.,https://dims.apnews.com/dims4/default/e965723/2147483647/strip/true/crop/3000x1998+0+1/resize/599x399!/quality/90/?url=https%3A%2F%2Fstorage.googleapis.com%2Fafs-prod%2Fmedia%2F704560c9d30d4fdc9d64e83b9db16bfa%2F3000.jpeg
https://apnews.com/article/sports-fifa-world-cup-paris-saint-germain-fc-rc-lens-neymar-10767eb2da867fabbec9db5c9fd7d360,"PSG braced for tough test at Lens, without Messi and Neymar",154.95.36.199,"December 30, 2022",PARIS (AP) — French league leader Paris Saint-Germain faces its toughest test of the season Sunday when it travels to play a Lens side which has won all of its home games.,https://dims.apnews.com/dims4/default/4226b1c/2147483647/strip/true/crop/2826x1882+0+118/resize/599x399!/quality/90/?url=https%3A%2F%2Fstorage.googleapis.com%2Fafs-prod%2Fmedia%2F32965dacc8dd42b394a761e7392076fb%2F2826.jpeg
https://apnews.com/article/king-charles-coronation-monarch-uk-britain-b5669453c120a0309b15a2b9aab27f64,"Lionel Richie, Katy Perry sing for royal coronation concert",154.95.36.199,"May 08, 2023","A day after a gilded coronation ceremony watched by millions, King Charles III and Queen Camilla had a much more relaxing time Sunday as they took in a concert featuring Katy Perry, Lionel Richie and others at Windsor Castle.",https://dims.apnews.com/dims4/default/b2397da/2147483647/strip/true/crop/3000x1998+0+13/resize/599x399!/quality/90/?url=https%3A%2F%2Fstorage.googleapis.com%2Fafs-prod%2Fmedia%2Feb82442108db429b94736fa15587e58c%2F3000.jpeg
https://apnews.com/article/world-cup-sports-soccer-france-middle-east-91ba807d347aadd5c21d6c1232c5c151,"PSG rests Marquinhos but Messi, Neymar and Mbappe in squad",154.95.36.199,"November 12, 2022",PARIS (AP) — Brazil defender Marquinhos has been rested for Paris Saint-Germain’s final game before the World Cup in Qatar because of muscle discomfort.,https://dims.apnews.com/dims4/default/d534c43/2147483647/strip/true/crop/3000x1998+0+1/resize/599x399!/quality/90/?url=https%3A%2F%2Fstorage.googleapis.com%2Fafs-prod%2Fmedia%2Fc75b097be2d544fe8a5e4d63384306b9%2F3000.jpeg
https://apnews.com/article/world-cup-sports-neymar-cristiano-ronaldo-croatia-0f4ddc859b53b3dfb96e3dd5a2ca5865,"Messi, Modric get Argentina, Croatia to World Cup semifinals",154.95.36.199,"December 13, 2022",First it was Neymar.,https://dims.apnews.com/dims4/default/d339aff/2147483647/strip/true/crop/3000x1998+0+1/resize/599x399!/quality/90/?url=https%3A%2F%2Fstorage.googleapis.com%2Fafs-prod%2Fmedia%2F99efd004e23b45caa9aa7bf4d1a2c8aa%2F3000.jpeg
