Url,Headline,ProxyIP,Publication Date,Content,Image URL
https://apnews.com/article/french-season-preview-psg-messi-mbappe-neymar-e637758263d02ecacd56f08ea874ca9d,Messi’s exit leaves a big hole at PSG as the club frets over Mbappe and Neymar,185.199.231.45,"August 08, 2023",There’s a big hole in the Paris Saint-Germain locker room where Lionel Messi used to sit. The way things are going at under-pressure PSG Kylian Mbappe may soon be vacating his spot also.,https://dims.apnews.com/dims4/default/f11d5f8/2147483647/strip/true/crop/3350x2231+0+1/resize/599x399!/quality/90/?url=https%3A%2F%2Fassets.apnews.com%2Fda%2F90%2F6597e9febfb130b1a2ffcc5359a1%2F1cb995e27c374fe689f65442c42473ee
https://apnews.com/article/argentina-maracana-stadium-world-cup-82dc84aed9afb43d53423bb93837a851,"Argentina returns to Maracana Stadium, where many believe pursuit of latest World Cup title began",185.199.231.45,"November 21, 2023",Many Argentinians believe that the pursuit of their country’s latest World Cup title started for real more than two years ago at Maracana Stadium.,No Image Found
https://apnews.com/article/messi-inter-miami-c6e5928476370b82999a01c20d658a74,"Inter Miami still targeting July 21 for Messi debut, waiting on paperwork",185.199.231.45,"June 29, 2023","Inter Miami is still targeting a July 21 debut match for Lionel Messi, though stopped short Thursday of saying that date was guaranteed.",https://dims.apnews.com/dims4/default/1f3a542/2147483647/strip/true/crop/2838x1890+0+1/resize/599x399!/quality/90/?url=https%3A%2F%2Fassets.apnews.com%2F71%2Fb8%2Ffffc5c4b3324f2abcf1bf1ac3ced%2Fc3e56b35997a4624abaab65b472d6126
https://apnews.com/article/lionel-messi-inter-miami-mls-f8460fb160e3552d1fbd40879c4ff5de,Messi speaks publicly for 1st time since joining Inter Miami and says he’s happy with his choice,185.199.231.45,"August 18, 2023",Lionel Messi spoke publicly Thursday for the first time since announcing on June 7 that he’d join Inter Miami.,https://dims.apnews.com/dims4/default/625b49e/2147483647/strip/true/crop/5349x3563+0+1/resize/599x399!/quality/90/?url=https%3A%2F%2Fassets.apnews.com%2Fa7%2F3f%2Fa13496ee99ae783a56d479276ff1%2Fbbdec6628a9a4c07af70e289fd9feae4
https://apnews.com/article/argentina-indonesia-friendly-messi-paredes-28237e7ec615cee61baa6a4d788ce54e,"Without Messi, Argentina labors to 2-0 win over Indonesia in friendly",185.199.231.45,"June 19, 2023","Argentina struggled to create chances without Lionel Messi in the team as it labored to a 2-0 win over Indonesia in a friendly, with both goals coming from defensive-minded players.",https://dims.apnews.com/dims4/default/edca4bf/2147483647/strip/true/crop/4151x2765+0+1/resize/599x399!/quality/90/?url=https%3A%2F%2Fassets.apnews.com%2F56%2F2a%2F3db0135eddbb36e982e40a46b28d%2Fa5ae0fc0cb53450fae18fb6c2e472e32
https://apnews.com/article/lionel-messi-miami-soccer-mania-inter-miami-6f3d5ff3a8f55433b67c44fab86cd646,Messi mania engulfs Miami over the arrival of the Argentine soccer superstar,185.199.231.45,"July 14, 2023",There is no hiding the euphoria generated by Messi in Miami as he begins the new Major League Soccer phase of his career in one of the most Latino cities in the United States.,https://dims.apnews.com/dims4/default/dedb2df/2147483647/strip/true/crop/5369x3576+0+1/resize/599x399!/quality/90/?url=https%3A%2F%2Fassets.apnews.com%2F17%2F07%2Ff9a17451180df00ea24cb9d5da28%2F36a3fa0b42414bc2ae40a7d005aef48e
https://apnews.com/article/messi-inter-miami-mls-bd0246b747572c84b5c79b653088c55f,"Messi scores twice, his third straight game with a goal, as Inter Miami beats Orlando City 3-1",185.199.231.45,"August 03, 2023",Lionel Messi scored in his third straight game and had his second consecutive multi-goal performance for Inter Miami in a 3-1 victory over Orlando City.,https://dims.apnews.com/dims4/default/4e41781/2147483647/strip/true/crop/2852x1900+0+1/resize/599x399!/quality/90/?url=https%3A%2F%2Fassets.apnews.com%2Fdf%2Ffe%2F0dc0a18c33907c6d797d29c95229%2Fe02f15c298e04c05a6d6a5f9fd4129b5
https://apnews.com/article/messi-mbappe-psg-madrid-transfer-f74ecdf9c1a8a1e1194b0bfb3711f830,"Amid own uncertain future, Mbappé hits out at treatment of Messi in France",185.199.231.45,"June 14, 2023",Kylian Mbappé's has hit out at the treatment of Lionel Messi during his time at Paris Saint-Germain following the high-profile departure of the Argentina star.,https://dims.apnews.com/dims4/default/b640c1e/2147483647/strip/true/crop/5616x3741+0+2/resize/599x399!/quality/90/?url=https%3A%2F%2Fassets.apnews.com%2F7e%2F90%2F10bcbade31415584d5681fecd8bc%2F0b2774a905674b52997129de0486a299
https://apnews.com/article/fan-fight-brazil-argentina-maracana-f560d95ff5bd96e6e13ec70f2d4a8084,Brawling fans in stands delay start of Argentina-Brazil World Cup qualifying match for 27 minutes,185.199.231.45,"November 22, 2023",A brawl between fans at Maracana Stadium delayed the start of the South American World Cup qualifying match between Argentina and Brazil for 27 minutes.,https://dims.apnews.com/dims4/default/03bd671/2147483647/strip/true/crop/4354x2900+0+1/resize/599x399!/quality/90/?url=https%3A%2F%2Fassets.apnews.com%2Fff%2Fc4%2F75fb669b0a3ec4e3c53ba8783bc9%2F890ace417ea54f33aa32559461271bd4
https://apnews.com/article/mls-inter-miami-lionel-messi-sergio-busquets-01eed8b494e95f9385e12714af6f6d35,Sergio Busquets is joining former Barcelona teammate Lionel Messi at Inter Miami,185.199.231.45,"June 24, 2023",Sergio Busquets is joining former Barcelona teammate Lionel Messi at Inter Miami. The team confirmed its second major addition in less than a month on Friday.,https://dims.apnews.com/dims4/default/1d7556a/2147483647/strip/true/crop/3110x2072+0+1/resize/599x399!/quality/90/?url=https%3A%2F%2Fassets.apnews.com%2F5c%2F14%2Fd59a68ec90c1936046e9125fa226%2F326b984682a5494aac5cf89aee0a190d
https://apnews.com/sports/fc-barcelona-fifa-world-cup-soccer-golf-coastal-carolina-chanticleers-643321465b50bcad1ffefd50599ce894,Today in Sports - FC Barcelona’ Argentine soccer player Lionel Messi scores his 700th career goal,185.199.231.45,"June 29, 2023","Today in Sports, June 30 - FC Barcelona’ Argentine soccer player Lionel Messi scores his 700th career goal",No Image Found
https://apnews.com/article/lionel-messi-miami-mls-soccer-056e46c642356061e93986b4dc06caed,"MLS hopes Messi will boost attendance, TV viewers and market share",185.199.231.45,"June 09, 2023","After two decades competing against Real Madrid, Manchester United and Brazil, Lionel Messi will be going against the NFL, Major League Baseball and the NBA.",https://dims.apnews.com/dims4/default/fe8c770/2147483647/strip/true/crop/2966x1976+17+0/resize/599x399!/quality/90/?url=https%3A%2F%2Fstorage.googleapis.com%2Fafs-prod%2Fmedia%2F98e302eb623448fab4ec524c4b1d2e41%2F3000.jpeg
https://apnews.com/article/messi-argentina-china-australia-asia-b445e455b7c0d34bb31c83af49c62167,"Messi, Argentina set to pull a big crowd in Beijing exhibition game against Australia",185.199.231.45,"June 14, 2023","Lionel Messi and his World Cup-winning Argentina teammates are expected to draw almost 70,000 fans to Beijing Worker’s Stadium for an international friendly against Australia.",https://dims.apnews.com/dims4/default/9106f67/2147483647/strip/true/crop/6000x3997+0+2/resize/599x399!/quality/90/?url=https%3A%2F%2Fassets.apnews.com%2F65%2F00%2F2d5e42ccfd43bd2c64302206a31a%2Fa0f1ecb9302a433dbbdf4c8902fef807
https://apnews.com/article/messi-psg-suspension-galtier-eea1c0e5a50dbc2345e3f2936712f4d3,Messi apologizes to PSG for unapproved Saudi Arabia trip,185.199.231.45,"May 05, 2023",Lionel Messi has apologized to Paris Saint-Germain and his teammates for going to Saudi Arabia on an unauthorized trip that resulted in his suspension.,https://dims.apnews.com/dims4/default/d6b7c89/2147483647/strip/true/crop/3000x1998+0+1/resize/599x399!/quality/90/?url=https%3A%2F%2Fstorage.googleapis.com%2Fafs-prod%2Fmedia%2Fcbf74518b42f480f90625eeb280486e7%2F3000.jpeg
https://apnews.com/article/cricket-world-cup-semifinals-india-australia-859ddf88246dec7847139c2db18123b0,Cricket World Cup talking points ahead of India-New Zealand and Australia-South Africa semifinals,185.199.231.45,"November 14, 2023",The Cricket World Cup is at the semifinal stage. Host nation India is playing New Zealand on Wednesday and South Africa plays Australia on Thursday.,https://dims.apnews.com/dims4/default/d0d69b6/2147483647/strip/true/crop/1946x1296+0+1/resize/599x399!/quality/90/?url=https%3A%2F%2Fassets.apnews.com%2F17%2Fd2%2F89f513d2adb6fc97fadbe8a901e6%2F2261d30dfd9b4acd8ed4b05e4f51adf8
https://apnews.com/article/psg-messi-french-league-d7f179e64cf84ac3b4a802f803e3af7b,Messi back in training with PSG after club lifts suspension,185.199.231.45,"May 08, 2023",Lionel Messi has returned to training with his Paris Saint-Germain teammates after the club lifted his suspension.,https://dims.apnews.com/dims4/default/d6b7c89/2147483647/strip/true/crop/3000x1998+0+1/resize/599x399!/quality/90/?url=https%3A%2F%2Fstorage.googleapis.com%2Fafs-prod%2Fmedia%2Fcbf74518b42f480f90625eeb280486e7%2F3000.jpeg
https://apnews.com/article/lionel-messi-barcelona-inter-miami-919767024734969d4f9dacc9afefcdb5,No homecoming for Messi as Barcelona again fails to do enough to lure him back,185.199.231.45,"June 08, 2023",Barcelona again couldn’t do enough to entice Lionel Messi. The club missed out on a chance to bring the World Cup winner back nearly two years after it was forced to let him go against his will because of its financial struggles.,https://dims.apnews.com/dims4/default/9032709/2147483647/strip/true/crop/3000x1998+0+1/resize/599x399!/quality/90/?url=https%3A%2F%2Fstorage.googleapis.com%2Fafs-prod%2Fmedia%2F5821828ff0ae4ce3aaee01f5b79b9d60%2F3000.jpeg
https://apnews.com/article/psg-messi-suspension-b72469b0fad7671c98d022e41dd241e5,PSG suspends Messi for unapproved trip to Saudi Arabia,185.199.231.45,"May 03, 2023",A person with knowledge of the situation tells The Associated Press that Lionel Messi has been suspended by Paris Saint-Germain for taking a trip to Saudi Arabia without the club’s permission.,https://dims.apnews.com/dims4/default/d6b7c89/2147483647/strip/true/crop/3000x1998+0+1/resize/599x399!/quality/90/?url=https%3A%2F%2Fstorage.googleapis.com%2Fafs-prod%2Fmedia%2Fcbf74518b42f480f90625eeb280486e7%2F3000.jpeg
https://apnews.com/article/womens-world-cup-ada-hegerberg-norway-6542cb515632b97f2b043289526eeb8a,Hegerberg seeks to emulate Messi and win World Cup to sate unfulfilled career with Norway,185.199.231.45,"July 03, 2023",Ada Hegerberg has often been described as the Lionel Messi of women’s soccer because of her scoring feats.,https://dims.apnews.com/dims4/default/c0f16a6/2147483647/strip/true/crop/2895x1928+0+1/resize/599x399!/quality/90/?url=https%3A%2F%2Fassets.apnews.com%2Fde%2Fbe%2Fb505a620b528c193e1055f15aa48%2Fedaf5d0b770248ff9bb8c7c2ae6e926b
https://apnews.com/article/inter-miami-orlando-city-mls-cc50838a4f9fad9f955c5fa7106ed96d,McGuire’s equalizer earns Orlando City 1-1 draw with Messi-less Inter Miami,185.199.231.45,"September 25, 2023","Rookie Duncan McGuire scored the equalizer in the 66th minute to help Orlando City gain a 1-1 draw with Inter Miami, extending the club’s unbeaten streak to 10.",https://dims.apnews.com/dims4/default/f8efc3e/2147483647/strip/true/crop/3907x2602+0+1/resize/599x399!/quality/90/?url=https%3A%2F%2Fassets.apnews.com%2F42%2F53%2F47f5c253b0293220a6785635e3dc%2F275d26c5e100410b9cb1acab203de9ad
https://apnews.com/article/super-bowl-commercials-2024-08ede12cbd5d7d6ba895e067cfc6393f,These are the buzziest Super Bowl ads so far,185.199.231.45,"February 07, 2024","If you watch the Super Bowl for the commercials, you no longer have to wait until the big game to see what advertisers have in store for viewers.",https://dims.apnews.com/dims4/default/01d2b19/2147483647/strip/true/crop/2111x1406+195+0/resize/599x399!/quality/90/?url=https%3A%2F%2Fassets.apnews.com%2F3a%2F42%2Fd8f5a49238230fa4c31b748886fc%2F1e133821b5974ef3bdecfa4df153ace4
https://apnews.com/sports/college-football-colorado-state-rams-fc-barcelona-boston-bruins-los-angeles-kings-0fd64413bb4f7d0064c24caf9301fc6a,"Today in Sports - Messi scores 644th goal for Barcelona, breaks Pele’s record most goals with 1 club",185.199.231.45,"December 21, 2023","Today in Sports, December 22 - Messi scores 644th goal for Barcelona, breaks Pele’s record most goals with 1 club",No Image Found
https://apnews.com/article/barcelona-espanyol-spanish-league-atletico-liga-6cb394a6964101fcb89ebd069c55d4c6,"Barcelona, minus Messi, wins Spanish league title for 1st time since 2019",185.199.231.45,"May 15, 2023",Barcelona has won its first Spanish league title after the departure of Lionel Messi with a 4-2 victory against Espanyol.,https://dims.apnews.com/dims4/default/292f03b/2147483647/strip/true/crop/3000x1998+0+1/resize/599x399!/quality/90/?url=https%3A%2F%2Fstorage.googleapis.com%2Fafs-prod%2Fmedia%2Fec7d4fa5a0b14ed39aeab0205151adf6%2F3000.jpeg
https://apnews.com/article/messi-psg-future-saudi-barcelona-mls-7a73275c19c2d993d997a8e4df385de8,What next for Messi? A look at the options if he leaves PSG,185.199.229.156,"April 06, 2023","When Lionel Messi was jeered by Paris Saint-Germain fans during last Sunday’s home defeat to Lyon, their relationship looked like it had reached breaking point.",https://dims.apnews.com/dims4/default/fd280fc/2147483647/strip/true/crop/3000x1998+0+1/resize/599x399!/quality/90/?url=https%3A%2F%2Fstorage.googleapis.com%2Fafs-prod%2Fmedia%2F47bed8ed58c642819d9d15f3231b6b3e%2F3000.jpeg
https://apnews.com/article/sports-soccer-ligue-1-world-cup-argentina-8ac4d0916a9384c3bff39693852322c2,Lionel Messi says World Cup in Qatar will be his last,185.199.229.156,"October 06, 2022",Lionel Messi has confirmed that the World Cup in Qatar next month will be the last of his career. The 35-year-old Argentina star will play in his fifth World Cup but is still seeking his first title at the showpiece tournament.,https://dims.apnews.com/dims4/default/7d07b08/2147483647/strip/true/crop/3000x1998+0+1/resize/599x399!/quality/90/?url=https%3A%2F%2Fstorage.googleapis.com%2Fafs-prod%2Fmedia%2F7f471f55f1e1443aab08778343d27565%2F3000.jpeg
https://apnews.com/article/messi-saudi-arabia-qatar-psg-soccer-0214bdb6b18926889e005f0dac1cbe3f,Messi the latest pawn in proxy rivalry in Middle East,185.199.229.156,"May 04, 2023",Lionel Messi was supposed to be training alongside his Paris Saint-Germain teammates at the start of the week with his club embroiled in a tight French league title race.,https://dims.apnews.com/dims4/default/a006edb/2147483647/strip/true/crop/3000x1998+0+1/resize/599x399!/quality/90/?url=https%3A%2F%2Fstorage.googleapis.com%2Fafs-prod%2Fmedia%2F8382c2e89ada4bada5d31fa343ef1875%2F3000.jpeg
https://apnews.com/article/world-cup-fifa-south-america-qualifying-54e2ded2f3dbb89c9fdbf22bada54cca,Defending champion Argentina starts as favorite when South American World Cup qualifying kicks off,185.199.229.156,"September 05, 2023",Lionel Messi and his Argentina lineup will be back on World Cup duty this week when their bid to defend the title starts in South American qualifying.,https://dims.apnews.com/dims4/default/e409b8d/2147483647/strip/true/crop/5373x3579+0+1/resize/599x399!/quality/90/?url=https%3A%2F%2Fassets.apnews.com%2F27%2Fc8%2Fb050836a59b33d337e2397145fa5%2F7a3d903dcc614e0a90eea5ec22ce1c27
https://apnews.com/article/psg-mbappe-future-qatari-owners-7e2f72f566a823da09cf7b4a2daf5e78,The future looks much brighter for Mbappé than PSG. The Qatari-owned club faces a tough transition,185.199.229.156,"February 16, 2024",The future looks much brighter for Kylian Mbappé than it does for Paris Saint-Germain. The Qatari-owned club faces a tough transition.,https://dims.apnews.com/dims4/default/35e9ab1/2147483647/strip/true/crop/3735x2488+0+1/resize/599x399!/quality/90/?url=https%3A%2F%2Fassets.apnews.com%2F8a%2F58%2F330be653eee9fe93fca52adcf1b3%2F56fac8ed8abc43f98cb1b44e6a41563b
https://apnews.com/article/jude-bellingham-england-euro-2024-db7081af7b86f86f99ece6389d29f637,England midfielder Jude Bellingham is on the rise in Europe’s post-Messi and Ronaldo era,185.199.229.156,"September 13, 2023",Jude Bellingham is already proving that he has what it takes to help fill the gigantic void left by Lionel Messi and Cristiano Ronaldo.,https://dims.apnews.com/dims4/default/2dd9ba9/2147483647/strip/true/crop/3627x2416+0+1/resize/599x399!/quality/90/?url=https%3A%2F%2Fassets.apnews.com%2F92%2F05%2Fbf9f9a5cf03e6a6353c321b9183a%2F9545cd037f86484f919aa7a08d9e85ab
https://apnews.com/article/world-cup-sports-soccer-argentina-national-team-pep-guardiola-d10bea92bd572a2b6326f0a1a15f38fd,Messi and Putellas voted best players at FIFA awards again,185.199.229.156,"February 28, 2023",World Cup winner Lionel Messi has won FIFA’s Best Men’s Player award for 2022. Spain’s Alexia Putellas won FIFA’s Best Women’s Player award for the second straight time.,https://dims.apnews.com/dims4/default/a180a3e/2147483647/strip/true/crop/3000x1998+0+18/resize/599x399!/quality/90/?url=https%3A%2F%2Fstorage.googleapis.com%2Fafs-prod%2Fmedia%2Fa1f4c7774c7040e0b8f1f0d2521f8ac0%2F3000.jpeg
https://apnews.com/article/yamila-rodriguez-ronaldo-messi-tattoo-7aeccc21b092118e6c815c9911a8552f,Argentina forward at Women’s World Cup defends her Ronaldo tattoo,185.199.229.156,"July 26, 2023",An Argentina forward who has a Cristiano Ronaldo tattoo wants fans to stop criticizing her for idolizing the Portugal star instead of national hero Lionel Messi.,https://dims.apnews.com/dims4/default/45362ac/2147483647/strip/true/crop/5215x3474+0+2/resize/599x399!/quality/90/?url=https%3A%2F%2Fassets.apnews.com%2F50%2F0b%2F7fe03debe7a9d11c94255f0e4d2b%2F5fe0015973534f3ab99f40e9107e2a45
https://apnews.com/article/asian-cup-qatar-e0eaace3b9138825b1ff2077bf5720fe,Asian Cup: Everything you need to know as World Cup host Qatar stages latest soccer tournament,185.199.229.156,"January 11, 2024","Just over a year after Lionel Messi led Argentina to the World Cup title in Qatar, international soccer is back in the Middle Eastern nation for the Asian Cup.",https://dims.apnews.com/dims4/default/3110a9c/2147483647/strip/true/crop/3733x2487+0+1/resize/599x399!/quality/90/?url=https%3A%2F%2Fassets.apnews.com%2Fb4%2F0d%2F8b6430a23f900a17fd63aabb75d7%2Fefae5b01ffe44c0ab74c56fde4aec8a0
https://apnews.com/article/barcelona-osasuna-spanish-super-cup-59634fd690919067321fe49e9c6d759d,Barcelona beats Osasuna and will play Real Madrid for 2nd straight year in Spanish Super Cup final,185.199.229.156,"January 12, 2024",Barcelona has defeated Osasuna 2-0 to set up a rematch of last year’s Super Cup final against Real Madrid in Saudi Arabia.,https://dims.apnews.com/dims4/default/5791e13/2147483647/strip/true/crop/4724x3147+0+2/resize/599x399!/quality/90/?url=https%3A%2F%2Fassets.apnews.com%2Ff0%2F12%2F22b40c6f12abf82fc7c2e61e684e%2F56d94889922b4a729c40fbd49b56b5cf
https://apnews.com/article/world-cup-sports-soccer-argentina-national-team-lionel-messi-35a4e7a9cf32163ffd852959c903d7df,Messi regrets controversy against Dutch at the World Cup,185.199.229.156,"January 30, 2023",World Cup winner Lionel Messi says in a radio interview aired on Monday that he regrets his testy exchanges with the Netherlands coach and players during their controversial quarterfinal in Qatar.,https://dims.apnews.com/dims4/default/673bdd8/2147483647/strip/true/crop/2997x1996+2+0/resize/599x399!/quality/90/?url=https%3A%2F%2Fstorage.googleapis.com%2Fafs-prod%2Fmedia%2F64778934816f43fc849140f435e5648e%2F3000.jpeg
https://apnews.com/article/major-league-soccer-us-open-cup-45d74a335e0de0b56612681ad221b059,Major League Soccer pulls top rosters from U.S. Open Cup,185.199.229.156,"December 16, 2023",Major League Soccer is pulling its top rosters from next year’s U.S. Open Cup and will replace them with player development sides from its MLS Next Pro teams.,https://dims.apnews.com/dims4/default/fbc5479/2147483647/strip/true/crop/4780x3184+0+1/resize/599x399!/quality/90/?url=https%3A%2F%2Fassets.apnews.com%2F43%2F33%2Ff852b7e748b9e6ef6d5a287050c7%2Fda1f9c73f88b4bc99ccc4f0fcf412ec8
https://apnews.com/article/messi-argentina-100-international-goals-700f0fc93bb2a09096ef83fe8f367c62,Lionel Messi surpasses 100 career goals for Argentina,185.199.229.156,"March 29, 2023","SANTIAGO DEL ESTERO, Argentina (AP) — Lionel Messi scored a hat trick and surpassed 100 career goals for Argentina with three in the first half of Tuesday’s international friendly against Curacao.",https://dims.apnews.com/dims4/default/e32db67/2147483647/strip/true/crop/3000x1998+0+1/resize/599x399!/quality/90/?url=https%3A%2F%2Fstorage.googleapis.com%2Fafs-prod%2Fmedia%2F2d88e1817e6840bf92286f243a5eed32%2F3000.jpeg
https://apnews.com/article/messi-supermarket-attack-gunmen-rosario-bullets-ce420f9d5d0daa06c3faccb8838b32d9,"Gunmen threaten Messi, shoot up family-owned supermarket",185.199.229.156,"March 03, 2023",Police say gunmen have left a threatening message for Argentine soccer superstar Lionel Messi and opened fire at a supermarket owned by his in-laws in Argentina’s third-largest city.,https://dims.apnews.com/dims4/default/4a1a27b/2147483647/strip/true/crop/3000x1998+0+1/resize/599x399!/quality/90/?url=https%3A%2F%2Fstorage.googleapis.com%2Fafs-prod%2Fmedia%2Fcb0a6b8b72094fae80b423fea4addcac%2F3000.jpeg
https://apnews.com/article/super-bowl-2024-commercials-preview-025d653b2abf0ceadc7e9c7850c0383a,Here’s what you can expect from Super Bowl commercials this Sunday,185.199.229.156,"February 10, 2024","Advertisers will be pulling out all the stops on Super Bowl Sunday — enlisting the biggest actors, investing in the most dazzling special effects and, they hope, going for laughs as they seek to win over viewers.",https://dims.apnews.com/dims4/default/aa12434/2147483647/strip/true/crop/2120x1412+199+0/resize/599x399!/quality/90/?url=https%3A%2F%2Fassets.apnews.com%2F54%2F0a%2F79a7792620ba5bc600a02ff82f4a%2Fe0756db371324ed9887459a22889282c
https://apnews.com/article/luis-suarez-golden-ball-gremio-79735944567ac1fa4743fa5d9a30d328,Luis Suárez wins the golden ball as the Brazilian league’s best player after season with Gremio,185.199.229.156,"December 08, 2023",Uruguayan striker Luis Suárez has won the golden ball as the player of the season in the Brazilian league. Suárez is a former teammate of Lionel Messi at Barcelona.,https://dims.apnews.com/dims4/default/857a7ac/2147483647/strip/true/crop/4862x3239+0+1/resize/599x399!/quality/90/?url=https%3A%2F%2Fassets.apnews.com%2F91%2Fbc%2F8d1a74588cd490f4229fddc6ba30%2Fcbf9c6e592354cd88c8b3806e61b75e3
https://apnews.com/article/inter-miami-st-louis-city-mls-9b5c233417747ee7926d6e197300b979,"On day Messi deal announced, Inter Miami’s winless streak reaches 11 with 3-0 loss to St Louis",185.199.229.156,"July 16, 2023","Hours after Inter Miami announced its contract with Lionel Messi, the team’s winless streak reached 11 with a 3-0 loss to St.",No Image Found
https://apnews.com/article/julio-urias-arrested-dodgers-88b8f248d9add4c84d84de7d83067d81,Dodgers pitcher Julio Urías arrested near Los Angeles stadium where Messi was playing MLS game,185.199.229.156,"September 05, 2023","Los Angeles Dodgers pitcher Julio Urías was arrested near BMO Stadium, where Lionel Messi was playing in a Major League Soccer game with numerous celebrities in attendance.",https://dims.apnews.com/dims4/default/7183f31/2147483647/strip/true/crop/6064x4039+0+2/resize/599x399!/quality/90/?url=https%3A%2F%2Fassets.apnews.com%2Fbb%2F55%2F7a79345e9c18ea02382b072891a1%2F68d4ff84c92748dabefa4d87634c1d48
https://apnews.com/article/real-madrid-barcelona-score-vinicius-super-cup-f1af27704787f98dceaa53a43848bc81,Vinícius nets hat trick as Real Madrid beats Barcelona 4-1 to win Spanish Super Cup in Saudi Arabia,185.199.229.156,"January 15, 2024",Vinícius Júnior has scored a first-half hat trick as Real Madrid beat Barcelona 4-1 to win the Spanish Super Cup in Saudi Arabia and lift its first trophy of the season.,https://dims.apnews.com/dims4/default/4baedaa/2147483647/strip/true/crop/4724x3147+0+2/resize/599x399!/quality/90/?url=https%3A%2F%2Fassets.apnews.com%2F45%2F41%2F7dc0d3617fcfb3d6ade3e1700222%2F797b805f1d88421fbe74fe46d75ff79f
https://apnews.com/article/sports-germany-lionel-messi-qatar-deb951d521f3e5f9f8be89fc3b300122,Messi makes his record 26th appearance at the World Cup,185.199.229.156,"December 18, 2022",Lionel Messi is making a record 26th appearance at the World Cup. That breaks a tie with Germany great Lothar Matthäus.,https://dims.apnews.com/dims4/default/44e1ab9/2147483647/strip/true/crop/3000x1998+0+1/resize/599x399!/quality/90/?url=https%3A%2F%2Fstorage.googleapis.com%2Fafs-prod%2Fmedia%2Fefa3e48688be4ff284ac3c65a543f52f%2F3000.jpeg
https://apnews.com/article/hugo-lloris-lafc-0b0ba95066a9d1b3fe68b7017a54d28d,French goalkeeper Hugo Lloris joins LAFC after 11 1/2 seasons with Tottenham,185.199.229.156,"December 31, 2023",Former World Cup champion Hugo Lloris became the latest 35-year-old-plus player to join Major League Soccer when the goalkeeper agreed to a one-year contract with Los Angeles FC and left Tottenham after 11 1/2 seasons.,https://dims.apnews.com/dims4/default/676c4a0/2147483647/strip/true/crop/6575x4380+0+2/resize/599x399!/quality/90/?url=https%3A%2F%2Fassets.apnews.com%2F61%2Fca%2Ff3df1de245bea61adb3a2dd5834e%2F79ae044563e54fb8a1bdebbbea325fbe
